{"$defs":{"strings":{"items":{"minLength":1,"type":"string"},"minItems":1,"type":"array","uniqueItems":true}},"$id":"https://atlas-suite.local/schemas/atlas-profile.schema.json","$schema":"https://json-schema.org/draft/2020-12/schema","additionalProperties":false,"properties":{"components":{"items":{"additionalProperties":false,"properties":{"adapter":{"type":"string"},"id":{"type":"string"},"owner":{"type":"string"},"required":{"type":"boolean"}},"required":["id","owner","adapter","required"],"type":"object"},"minItems":1,"type":"array"},"effects":{"items":{"additionalProperties":false,"properties":{"approval_gate":{"type":["string","null"]},"description":{"type":"string"},"id":{"enum":["read_repository","write_source","network","provider","protected_effect"]},"required":{"type":"boolean"}},"required":["id","required","approval_gate","description"],"type":"object"},"minItems":1,"type":"array"},"execution_order":{"items":{"additionalProperties":false,"properties":{"id":{"type":"string"},"module":{"type":"string"},"produces":{"items":{"type":"string"},"minItems":1,"type":"array"},"requires":{"items":{"type":"string"},"type":"array"}},"required":["id","module","requires","produces"],"type":"object"},"minItems":1,"type":"array"},"gates":{"items":{"additionalProperties":false,"properties":{"description":{"type":"string"},"id":{"type":"string"},"input":{"type":"string"},"kind":{"enum":["authority","evidence","verification"]},"required":{"type":"boolean"}},"required":["id","kind","input","required","description"],"type":"object"},"minItems":1,"type":"array"},"id":{"type":"string"},"inputs":{"items":{"additionalProperties":false,"properties":{"description":{"minLength":1,"type":"string"},"id":{"type":"string"},"kind":{"enum":["context","intent","policy","authority"]},"required":{"type":"boolean"},"source":{"enum":["repository","task","policy","active-session-user-approval"]}},"required":["id","kind","required","source","description"],"type":"object"},"minItems":1,"type":"array"},"intent":{"minLength":1,"type":"string"},"invariants":{"$ref":"#/$defs/strings"},"maturity":{"enum":["candidate","component-qualified","composition-qualified","scenario-qualified","portable","release-qualified","deprecated"]},"outputs":{"items":{"additionalProperties":false,"properties":{"description":{"type":"string"},"id":{"type":"string"}},"required":["id","description"],"type":"object"},"minItems":1,"type":"array"},"proof_limits":{"$ref":"#/$defs/strings"},"qualification":{"additionalProperties":false,"properties":{"proof_plan":{"type":"string"},"receipt_refs":{"items":{"type":"string"},"maxItems":1,"minItems":1,"type":"array"},"result_ref":{"type":"string"},"verification_refs":{"items":{"type":"string"},"maxItems":1,"minItems":1,"type":"array"}},"required":["proof_plan","receipt_refs","result_ref","verification_refs"],"type":"object"},"schema":{"const":"atlas-profile/1.0"},"smallest_manual_test":{"minLength":1,"type":"string"},"standing":{"enum":["observed","documented","derived","proposed","unknown","stale","rejected"]},"tuning":{"items":{"additionalProperties":false,"properties":{"allowed":{"$ref":"#/$defs/strings"},"default":{"type":"string"},"id":{"type":"string"}},"required":["id","allowed","default"],"type":"object"},"type":"array"}},"required":["schema","id","intent","standing","maturity","components","inputs","execution_order","outputs","effects","gates","invariants","tuning","qualification","proof_limits","smallest_manual_test"],"title":"Atlas transparent profile 1.0","type":"object"}
