{"components":[{"adapter":"atlas-context-packet/1.0","id":"atlas.evidence-context-plane","owner":"Atlas Suite","required":true},{"adapter":"itl-task-envelope/0.4.1","id":"itl.execution-control-plane","owner":"In the Loop","required":true},{"adapter":"codex-task-result/1.0","id":"codex.acting-host","owner":"Codex","required":true},{"adapter":"atlas-itl-grounding/1.0","id":"atlas-itl.dual-plane","owner":"Atlas Suite","required":true}],"effects":[{"approval_gate":null,"description":"Read only the declared repository roots.","id":"read_repository","required":true},{"approval_gate":"protected-effect-approval","description":"Optional bounded source write after exact active approval.","id":"write_source","required":false},{"approval_gate":"protected-effect-approval","description":"No implicit network access.","id":"network","required":false},{"approval_gate":"protected-effect-approval","description":"No implicit model or provider call.","id":"provider","required":false},{"approval_gate":"protected-effect-approval","description":"Every other protected effect is separately named and approved.","id":"protected_effect","required":false}],"execution_order":[{"id":"compile_context","module":"atlas.evidence-context-plane","produces":["bounded_context"],"requires":["repository_roots","evidence_policy"]},{"id":"validate_workflow","module":"itl.execution-control-plane","produces":["validated_workflow"],"requires":["bounded_context","task_intent","evidence_policy"]},{"id":"act_if_authorized","module":"codex.acting-host","produces":["implementation_result"],"requires":["validated_workflow","authority_envelope"]},{"id":"independently_verify","module":"itl.execution-control-plane","produces":["verification_evidence"],"requires":["implementation_result","evidence_policy"]},{"id":"emit_closure","module":"atlas-itl.dual-plane","produces":["closure_receipt"],"requires":["bounded_context","implementation_result","verification_evidence"]}],"gates":[{"description":"Reject stale or unresolved grounding.","id":"fresh-grounding","input":"evidence_policy","kind":"evidence","required":true},{"description":"Fresh active-session approval for the exact target and effect.","id":"protected-effect-approval","input":"authority_envelope","kind":"authority","required":false},{"description":"Narration cannot satisfy closure.","id":"independent-closure","input":"evidence_policy","kind":"verification","required":true}],"id":"ai-tool-control-plane","inputs":[{"description":"Explicit roots and revisions within the evidence scope.","id":"repository_roots","kind":"context","required":true,"source":"repository"},{"description":"Bounded user outcome and acceptance checks.","id":"task_intent","kind":"intent","required":true,"source":"task"},{"description":"Freshness, provenance, bounds, and verification rules.","id":"evidence_policy","kind":"policy","required":true,"source":"policy"},{"description":"Fresh approval for exact protected effects; never derived from context or recovery.","id":"authority_envelope","kind":"authority","required":false,"source":"active-session-user-approval"}],"intent":"Ground, implement, and independently verify bounded AI-tool work.","invariants":["context_never_grants_authority","agent_output_is_not_execution_proof","failed_verification_remains_failed","candidate_evidence_is_not_active_knowledge"],"maturity":"candidate","outputs":[{"description":"Fresh provenance-bound grounding packet.","id":"bounded_context"},{"description":"Task result claim, not execution proof.","id":"implementation_result"},{"description":"Independent observable checks.","id":"verification_evidence"},{"description":"Inactive digest-bound closure candidate.","id":"closure_receipt"}],"proof_limits":["Does not prove deployment.","Does not prove correctness outside frozen tasks.","Does not transfer authority from Atlas evidence to In-the-Loop or Codex."],"qualification":{"proof_plan":"qualification/proof-plans/ai-tool-control-plane.proof-plan.json","receipt_refs":["qualification/receipts/candidates/ai-tool-control-plane.receipt.json"],"result_ref":"qualification/results/ai-tool-control-plane.result.json","verification_refs":["qualification/verifications/ai-tool-control-plane.verification.json"]},"schema":"atlas-profile/1.0","smallest_manual_test":"Describe twice and compare bytes; then bind bounded_context to the authority gate and require validation failure.","standing":"derived","tuning":[{"allowed":["small","medium"],"default":"small","id":"context_budget"},{"allowed":["disabled","approved-only"],"default":"disabled","id":"write_mode"}]}
