{"components":[{"adapter":"atlas-context-packet/1.0","id":"atlas.evidence-context-plane","owner":"Atlas Suite","required":true},{"adapter":"atlas-projection-set/1.0","id":"atlas.multi-projection-compiler","owner":"Project Atlas","required":true},{"adapter":"atlas-contract-spine/1.0","id":"atlas.cross-root-contract-spine","owner":"Atlas Suite","required":true},{"adapter":"atlas-profile/1.0","id":"atlas.profile-system","owner":"Atlas Suite","required":true}],"effects":[{"approval_gate":null,"description":"Read only the declared roots.","id":"read_repository","required":true},{"approval_gate":"protected-effect-approval","description":"Disabled unless a later fixture write is approved.","id":"write_source","required":false},{"approval_gate":"protected-effect-approval","description":"No implicit network access.","id":"network","required":false},{"approval_gate":"protected-effect-approval","description":"No implicit provider call.","id":"provider","required":false},{"approval_gate":"protected-effect-approval","description":"No runtime launch, deployment, or publication.","id":"protected_effect","required":false}],"execution_order":[{"id":"compile_sources","module":"atlas.evidence-context-plane","produces":["source_snapshot"],"requires":["repository_roots","evidence_policy"]},{"id":"compile_projections","module":"atlas.multi-projection-compiler","produces":["projection_set"],"requires":["source_snapshot"]},{"id":"trace_contract","module":"atlas.cross-root-contract-spine","produces":["contract_spine","drift_findings"],"requires":["projection_set","contract_intent"]},{"id":"emit_plan","module":"atlas.profile-system","produces":["qualification_plan"],"requires":["contract_spine","drift_findings","evidence_policy"]}],"gates":[{"description":"Reject unresolved roots, anchors, and stale ledgers.","id":"source-freshness","input":"evidence_policy","kind":"evidence","required":true},{"description":"Separate fresh approval for any later protected fixture effect.","id":"protected-effect-approval","input":"authority_envelope","kind":"authority","required":false},{"description":"Integration evidence, not narration, decides compatibility.","id":"independent-contract-verification","input":"evidence_policy","kind":"verification","required":true}],"id":"fullstack-contract-spine","inputs":[{"description":"Explicit frontend and backend roots, revisions, and dirty-state policy.","id":"repository_roots","kind":"context","required":true,"source":"repository"},{"description":"The declared capability and layers to compare.","id":"contract_intent","kind":"intent","required":true,"source":"task"},{"description":"Freshness, source-anchor, drift, and verification rules.","id":"evidence_policy","kind":"policy","required":true,"source":"policy"},{"description":"Unused by read-only discovery; reserved for separately approved fixture effects.","id":"authority_envelope","kind":"authority","required":false,"source":"active-session-user-approval"}],"intent":"Trace and qualify a declared contract across frontend and backend roots without assuming runtime compatibility.","invariants":["shared_capability_id_does_not_imply_api_compatibility","every_layer_has_its_own_receipt","later_layers_never_rewrite_earlier_receipts","no_hidden_adapter_fallback"],"maturity":"candidate","outputs":[{"description":"Declaration-, schema-, payload-, auth-, error-, and runtime-layer map.","id":"contract_spine"},{"description":"Bounded findings with exact source anchors and proof class.","id":"drift_findings"},{"description":"Read-only plan; no fixture has run.","id":"qualification_plan"}],"proof_limits":["Current baseline proves declaration-backed semantic identity only.","Does not prove production reliability outside fixtures.","Does not infer compatibility from names or shared IDs."],"qualification":{"proof_plan":"qualification/proof-plans/fullstack-contract-spine.proof-plan.json","receipt_refs":["qualification/receipts/candidates/fullstack-contract-spine.receipt.json"],"result_ref":"qualification/results/fullstack-contract-spine.result.json","verification_refs":["qualification/verifications/fullstack-contract-spine.verification.json"]},"schema":"atlas-profile/1.0","smallest_manual_test":"Describe the profile twice, then replace one component adapter with an unregistered value and require refusal before repository reads.","standing":"derived","tuning":[{"allowed":["declaration","schema","contract","runtime"],"default":"declaration","id":"highest_layer"},{"allowed":["report","fail-closed"],"default":"fail-closed","id":"drift_mode"}]}
