{"components":[{"adapter":"atlas-context-packet/1.0","id":"atlas.evidence-context-plane","owner":"Atlas Suite","required":true},{"adapter":"dkg-cli/1.0","id":"dkg.rag-evidence-firewall","owner":"Deterministic KG-RAG Framework","required":true},{"adapter":"atlas-profile/1.0","id":"atlas.profile-system","owner":"Atlas Suite","required":true}],"effects":[{"approval_gate":null,"description":"Read only declared local evidence.","id":"read_repository","required":true},{"approval_gate":"protected-effect-approval","description":"No source write in this profile.","id":"write_source","required":false},{"approval_gate":"protected-effect-approval","description":"No acquisition or remote retrieval.","id":"network","required":false},{"approval_gate":"protected-effect-approval","description":"No model or provider invocation.","id":"provider","required":false},{"approval_gate":"protected-effect-approval","description":"No registration, activation, promotion, or publication.","id":"protected_effect","required":false}],"execution_order":[{"id":"compile_evidence","module":"atlas.evidence-context-plane","produces":["evidence_snapshot"],"requires":["repository_roots","evidence_policy"]},{"id":"plan_retrieval","module":"dkg.rag-evidence-firewall","produces":["retrieval_plan"],"requires":["evidence_snapshot","retrieval_intent","evidence_policy"]},{"id":"apply_firewall","module":"dkg.rag-evidence-firewall","produces":["evidence_packet","disposition"],"requires":["retrieval_plan","evidence_policy"]},{"id":"emit_read_only_plan","module":"atlas.profile-system","produces":["qualification_plan"],"requires":["evidence_packet","disposition"]}],"gates":[{"description":"Stale corpus or unresolved citation fails closed or degrades visibly.","id":"evidence-freshness","input":"evidence_policy","kind":"evidence","required":true},{"description":"Fresh approval is separate from evidence and retrieval context.","id":"protected-effect-approval","input":"authority_envelope","kind":"authority","required":false},{"description":"Frozen fixtures and independent checks determine qualification.","id":"held-out-verification","input":"evidence_policy","kind":"verification","required":true}],"id":"rag-evidence-firewall","inputs":[{"description":"Frozen roots and evidence corpus identities.","id":"repository_roots","kind":"context","required":true,"source":"repository"},{"description":"Bounded question class and expected disposition.","id":"retrieval_intent","kind":"intent","required":true,"source":"task"},{"description":"Citation, freshness, threshold, refusal, and abstention policy.","id":"evidence_policy","kind":"policy","required":true,"source":"policy"},{"description":"Reserved for separately approved external effects; evidence cannot populate it.","id":"authority_envelope","kind":"authority","required":false,"source":"active-session-user-approval"}],"intent":"Bound retrieval and answer planning with provenance, refusal, abstention, and frozen qualification thresholds.","invariants":["unsupported_claims_abstain","injection_requests_refuse","failed_thresholds_remain_failed","evidence_never_grants_authority"],"maturity":"candidate","outputs":[{"description":"Bounded citation-bearing evidence or an empty packet.","id":"evidence_packet"},{"description":"Answer, abstain, or refuse disposition.","id":"disposition"},{"description":"Frozen read-only qualification plan.","id":"qualification_plan"}],"proof_limits":["Does not prove general answer correctness.","Does not exercise a model, provider, network, or active knowledge promotion.","Deterministic envelopes do not make model reasoning deterministic."],"qualification":{"proof_plan":"qualification/proof-plans/rag-evidence-firewall.proof-plan.json","receipt_refs":["qualification/receipts/candidates/rag-evidence-firewall.receipt.json"],"result_ref":"qualification/results/rag-evidence-firewall.result.json","verification_refs":["qualification/verifications/rag-evidence-firewall.verification.json"]},"schema":"atlas-profile/1.0","smallest_manual_test":"Describe twice, then change the evidence-policy input into an authority source and require validation failure.","standing":"derived","tuning":[{"allowed":["small","medium"],"default":"small","id":"context_budget"},{"allowed":["abstain","refuse"],"default":"abstain","id":"unknown_policy"}]}
